UploadCatName,UploadCatDesc,UploadQuestionTxt,UploadAnswerCorrect,UploadAnswer1,UploadAnswer2,UploadAnswer3,UploadAnswer4,UploadAnswer5,UploadExplnText
Everquest,Online Games: Everquest,What Everquest class combines attributes of a Warrior and a Necromancer?,Shadow Knight,Beastlord,,Ranger,Paladin,Magician,The Shadow Knight class combines Warrior (fighting/tanking) and Necromancer (lifestealing/lifeanimation/damage over time).
Everquest,Online Games: Everquest,,Cleric,Paladin,Druid,Shaman,Wizard,Bard,
Everquest,Online Games: Everquest,What Everquest class can only use 2 Hand weapons?,,Bard,Rogue,Warrior,Shaman,Monk,Only the Berzerker class is restricted to 2 Hand weapons only.
Everquest,,"What classes are known as ""Pet Classes"" in Everquest?",MAG BST NEC,SHD SHM DRU,SHM DRU WAR,RNG WIZ MNK,BRD PAL DRU,CLR RNG WIZ,"The ""true"" Everquest ""Pet Classes"" are Necromancer, Beastlord and Magician."
,Online Games: Everquest,What two classes can teleport groups? And testing Nonsense characters to exceed 256 character field limit zzzzzzzzzzzzzzzzzzzzzzzzzzzzzzzzzzzzzzzzzzzzzzzzzzzzzzzzzzzzzzzzzzzzzzzzzzzzzzzzzzzzzzzzzzzzzzzzzzzzzzzzzzzzzzzzzzzzzzzzzzzzzzzzzzzzzzzzzzzzzzzzzzzZZZZZZZZZZZZZZ,Wizard and Druid,Shaman and Magician,Warrior and Ranger,Paladin and Cleic,Tom and Jerry,Jekyll and Hyde,The transport classes are Druid and Wizard.  Other classes can teleport themselves but not others.
